{
  "taskId": "TASK-0227",
  "baseCommit": "568ba6cc5951895b25227eeef4df5922b1283154",
  "headCommit": "7ec43a465c2c478468ce841166b8378613b05dcc",
  "contextFingerprint": "6b44a5d9f883be3bc713723201cab8d2532ae13b77fa3fb2c799b48fb80e76c7",
  "deliveryTiming": {
    "overallElapsed": {
      "anchor": "DRAFT_COMMIT",
      "anchorCommit": "aa291ce90ca7e61efae8cd2556cf497588d70ca9",
      "startedAt": "2026-08-15T22:54:23+08:00",
      "endedAt": "2026-08-15T22:55:00+08:00",
      "elapsedSeconds": 37,
      "reanchored": false
    },
    "intakeActivation": {
      "anchor": "DRAFT_COMMIT",
      "anchorCommit": "aa291ce90ca7e61efae8cd2556cf497588d70ca9",
      "startedAt": "2026-08-15T22:54:23+08:00",
      "endedAt": "2026-08-15T22:54:25+08:00",
      "elapsedSeconds": 2,
      "outcome": "UNKNOWN",
      "targetWallMinutes": 60,
      "hardFuseWallMinutes": 90,
      "closureOnlyOverrunSeconds": 0,
      "inProgressCommit": "7ec43a465c2c478468ce841166b8378613b05dcc"
    },
    "candidateExecution": {
      "anchor": "READY_DOCTOR_PASS_AND_IN_PROGRESS_COMMIT",
      "anchorCommit": "7ec43a465c2c478468ce841166b8378613b05dcc",
      "startedAt": "2026-08-15T22:54:47+08:00",
      "endedAt": "2026-08-15T22:55:00+08:00",
      "elapsedSeconds": 13,
      "outcome": "PASS",
      "targetWallMinutes": 60,
      "hardFuseWallMinutes": 90,
      "candidateDeadlineMinutes": 45,
      "closureOnlyOverrunSeconds": 0,
      "readyDoctorPassAt": "2026-08-15T22:54:25+08:00",
      "inProgressCommit": "7ec43a465c2c478468ce841166b8378613b05dcc"
    }
  },
  "reviewers": [],
  "checks": [
    {
      "command": "pnpm --dir frontend exec vitest run src/pages/chat/chat.spec.ts",
      "status": "PASS",
      "exitCode": 0,
      "artifactHash": null,
      "reason": "21/21 tests PASS on candidate 7ec43a4: relationship load error shows dedicated copy, hides current-relationship, no send/cancel/activate.",
      "environment": "macOS; vitest 3.2.6",
      "verifiedCommit": "7ec43a465c2c478468ce841166b8378613b05dcc",
      "candidateCommit": "7ec43a465c2c478468ce841166b8378613b05dcc",
      "candidateTree": "749d4443f3a60b08ba879027b59224e68cef6e78"
    },
    {
      "command": "git diff --check",
      "status": "PASS",
      "exitCode": 0,
      "artifactHash": null,
      "reason": "git diff --check exit 0 on candidate 7ec43a4.",
      "environment": "macOS",
      "verifiedCommit": "7ec43a465c2c478468ce841166b8378613b05dcc"
    },
    {
      "command": "PATH=/Users/hxf/.zcode/venvs/vc-harness/bin:$PATH python scripts/harness/doctor.py --task TASK-0227",
      "status": "NOT_RUN",
      "exitCode": null,
      "artifactHash": null,
      "reason": "Owner 本轮 Goal 明确不跑长 Doctor。Honest NOT_RUN, never PASS.",
      "environment": "macOS; skipped"
    },
    {
      "command": "PATH=/Users/hxf/.zcode/venvs/vc-harness/bin:$PATH python scripts/harness/precheck.py --task TASK-0227",
      "status": "NOT_RUN",
      "exitCode": null,
      "artifactHash": null,
      "reason": "Owner 本轮 Goal 明确不跑长 precheck。Honest NOT_RUN, never PASS.",
      "environment": "macOS; skipped"
    },
    {
      "command": "PATH=/Users/hxf/.zcode/venvs/vc-harness/bin:$PATH python scripts/harness/doctor.py --task TASK-0227 --pre-closure",
      "status": "NOT_RUN",
      "exitCode": null,
      "artifactHash": null,
      "reason": "Owner 本轮 Goal 明确不跑长 pre-closure。Honest NOT_RUN, never PASS.",
      "environment": "macOS; skipped"
    }
  ]
}
