{
  "taskId": "TASK-0197",
  "baseCommit": "1c1dca2f423ea9935000189e86789201cb859832",
  "headCommit": "44bc6aaa9f495268cbddf4606cd058f1fd87ee0d",
  "contextFingerprint": "b4d806ce7e2d4a82a53f52d9f447a57b5834143b6afbaca135f85ec363d92905",
  "deliveryTiming": {
    "overallElapsed": {
      "anchor": "DRAFT_COMMIT",
      "anchorCommit": "d579e9b4e11afbc8b75d1f7fbfdbce60a4d80c33",
      "startedAt": "2026-08-15T02:37:44+08:00",
      "endedAt": "2026-08-15T11:28:06+08:00",
      "elapsedSeconds": 31822,
      "reanchored": false
    },
    "intakeActivation": {
      "anchor": "DRAFT_COMMIT",
      "anchorCommit": "d579e9b4e11afbc8b75d1f7fbfdbce60a4d80c33",
      "startedAt": "2026-08-15T02:37:44+08:00",
      "endedAt": "2026-08-15T11:28:06+08:00",
      "elapsedSeconds": 31822,
      "outcome": "UNKNOWN",
      "targetWallMinutes": 60,
      "hardFuseWallMinutes": 90,
      "closureOnlyOverrunSeconds": 26422,
      "reason": "MUST_SPLIT readyForbiddenUntilSplit=true; READY never attempted. DRAFT Doctor PASS is not READY Doctor. Honest UNKNOWN, never PASS."
    },
    "candidateExecution": {
      "anchor": "NOT_STARTED_READY_DOCTOR_NON_PASS",
      "anchorCommit": null,
      "startedAt": null,
      "endedAt": null,
      "elapsedSeconds": 0,
      "outcome": "NOT_STARTED",
      "targetWallMinutes": 60,
      "hardFuseWallMinutes": 90,
      "candidateDeadlineMinutes": 45,
      "closureOnlyOverrunSeconds": 0,
      "readyDoctorPassAt": null,
      "inProgressCommit": null,
      "reason": "MUST_SPLIT forbade READY; no READY Doctor was launched; DRAFT Doctor PASS is not READY Doctor; no IN_PROGRESS commit; no candidate freeze. NOT_STARTED recorded honestly and never converted to PASS.",
      "reanchored": false
    }
  },
  "reviewers": [
    {
      "id": "task0197_r1",
      "kind": "independent-review-gate",
      "verdict": "UNKNOWN",
      "reviewedCommit": "44bc6aaa9f495268cbddf4606cd058f1fd87ee0d",
      "evidencePath": "docs/evidence/TASK-0197/review-r1.md",
      "reason": "Independent review never launched: MUST_SPLIT readyForbiddenUntilSplit=true stopped promotion before READY. reviewedCommit/candidateTree are the last DRAFT commit and its tree, recorded only to satisfy 40-hex fields; they are not implementation-candidate identity. Honest UNKNOWN, never PASS.",
      "candidateTree": "d46ec98c2c867c72060fb46fd202acc169d4934c",
      "budget": {
        "maximumMinutes": 15,
        "elapsedSeconds": 0,
        "hardLimitReached": false
      },
      "interruption": {
        "terminalOutputReceived": false,
        "observedStatus": "REVIEWER_NEVER_LAUNCHED",
        "action": "REJECT_TASK_AT_MUST_SPLIT_NEVER_READY"
      }
    }
  ],
  "checks": [
    {
      "command": "PATH=/Users/hxf/.zcode/venvs/vc-harness/bin:$PATH python scripts/harness/doctor.py --summary (restore-1)",
      "status": "PASS",
      "exitCode": 0,
      "artifactHash": null,
      "reason": "Clean HEAD 44bc6aa before closure edits; 919649 checks, 92.9s, exit 0. DRAFT-era warehouse check only; not TASK-0196 legal-closure proof and not READY Doctor.",
      "environment": "macOS; PATH=/Users/hxf/.zcode/venvs/vc-harness/bin; Python 3.13.0; scratch doctor-summary-1.log",
      "verifiedCommit": "44bc6aaa9f495268cbddf4606cd058f1fd87ee0d"
    },
    {
      "command": "PATH=/Users/hxf/.zcode/venvs/vc-harness/bin:$PATH python scripts/harness/doctor.py --summary (restore-2)",
      "status": "PASS",
      "exitCode": 0,
      "artifactHash": null,
      "reason": "Second restore run on same clean HEAD 44bc6aa; 919649 checks, receipt hit, exit 0. Same direction as restore-1.",
      "environment": "macOS; PATH=/Users/hxf/.zcode/venvs/vc-harness/bin; Python 3.13.0; scratch doctor-summary-2.log",
      "verifiedCommit": "44bc6aaa9f495268cbddf4606cd058f1fd87ee0d"
    },
    {
      "command": "PATH=/Users/hxf/.zcode/venvs/vc-harness/bin:$PATH python scripts/harness/precheck.py --task TASK-0197",
      "status": "PASS",
      "exitCode": 0,
      "artifactHash": null,
      "reason": "Official staged-candidate precheck PASS (8 commands). Inner doctor --task TASK-0197 PASS 1140600 checks / 493.2s / exit 0; catalogValidate/catalogDrift/paidFeatureCheck/licenseCheck/betaRosterGate/openapiValidate/openapiDrift all exit 0. Ran on exact staged terminal snapshot (parent 44bc6aa + 6 terminal-only paths). Not READY Doctor and not TASK-0196 legal-closure proof.",
      "environment": "macOS; PATH=/Users/hxf/.zcode/venvs/vc-harness/bin; Python 3.13.0; scratch task-0197-precheck.log",
      "verifiedCommit": "44bc6aaa9f495268cbddf4606cd058f1fd87ee0d"
    },
    {
      "command": "PYTHONPATH=scripts/harness:scripts/harness/tests python -m unittest test_harness.Task0197InvalidClosureGovernanceTests test_harness.Task0098PostTerminalTailTests test_harness.Task0189PostTerminalTailTests test_harness.Task0196PostTerminalTailTests",
      "status": "FAIL",
      "exitCode": 1,
      "artifactHash": null,
      "reason": "Honest FAIL: Ran 31 tests in 239.313s, errors=1. Task0197InvalidClosureGovernanceTests does not exist (this card must not implement that class; successor GOVERNANCE/HISTORY implements it). Task0098/0189/0196 classes ran (30 tests). Exit 1 is not converted to PASS.",
      "environment": "macOS; PATH=/Users/hxf/.zcode/venvs/vc-harness/bin; Python 3.13.0; scratch task-0197-required-commands-partial.log",
      "verifiedCommit": "44bc6aaa9f495268cbddf4606cd058f1fd87ee0d"
    },
    {
      "command": "git diff --check",
      "status": "PASS",
      "exitCode": 0,
      "artifactHash": null,
      "reason": "git diff --check exit 0 on the closure worktree before official pre-closure.",
      "environment": "macOS; git diff --check",
      "verifiedCommit": "44bc6aaa9f495268cbddf4606cd058f1fd87ee0d"
    },
    {
      "command": "PATH=/Users/hxf/.zcode/venvs/vc-harness/bin:$PATH python scripts/harness/doctor.py --task TASK-0197 --pre-closure (attempt-1)",
      "status": "FAIL",
      "exitCode": 1,
      "artifactHash": null,
      "reason": "First staged pre-closure FAIL (1 error, 1140600 checks, 494s): terminal C4 task requires structured independent reviewers. Card reviewers was []. Honest FAIL, not converted to PASS. Fixed by adding structured UNKNOWN reviewer on the card (no implementation review claimed).",
      "environment": "macOS; PATH=/Users/hxf/.zcode/venvs/vc-harness/bin; Python 3.13.0; scratch task-0197-preclosure-1.log"
    },
    {
      "command": "PATH=/Users/hxf/.zcode/venvs/vc-harness/bin:$PATH python scripts/harness/doctor.py --task TASK-0197 --pre-closure",
      "status": "PASS",
      "exitCode": 0,
      "artifactHash": null,
      "reason": "Official staged-candidate pre-closure after adding structured UNKNOWN reviewer: PASS 1140600 checks / 494.3s / exit 0. Same 6 terminal-only paths. First attempt FAIL (missing reviewers) remains recorded above and is not rewritten as PASS.",
      "environment": "macOS; PATH=/Users/hxf/.zcode/venvs/vc-harness/bin; Python 3.13.0; scratch task-0197-preclosure-2.log",
      "verifiedCommit": "44bc6aaa9f495268cbddf4606cd058f1fd87ee0d"
    }
  ]
}
