{
  "taskId": "TASK-0212",
  "baseCommit": "1391cb11d6b0fbf87148dc2e0f63c78f455055b7",
  "headCommit": "5e9389fbd5bc5d192daaabcabb2e75d9563c2f17",
  "contextFingerprint": "3907911707ff648f97f5e68b34ef0f9fce785be0bdff3905170c1f2e664cbe60",
  "deliveryTiming": {
    "overallElapsed": {
      "anchor": "DRAFT_COMMIT",
      "anchorCommit": "52ad5601551042d1c0d1e6a0635132cbe01f99f5",
      "startedAt": "2026-08-15T20:23:43+08:00",
      "endedAt": "2026-08-15T20:41:31+08:00",
      "elapsedSeconds": 1068,
      "reanchored": false
    },
    "intakeActivation": {
      "anchor": "DRAFT_COMMIT",
      "anchorCommit": "52ad5601551042d1c0d1e6a0635132cbe01f99f5",
      "startedAt": "2026-08-15T20:23:43+08:00",
      "endedAt": "2026-08-15T20:26:25+08:00",
      "elapsedSeconds": 162,
      "outcome": "PASS",
      "targetWallMinutes": 60,
      "hardFuseWallMinutes": 90,
      "closureOnlyOverrunSeconds": 0,
      "readyDoctorPassAt": "2026-08-15T20:26:25+08:00",
      "inProgressCommit": "5e9389fbd5bc5d192daaabcabb2e75d9563c2f17"
    },
    "candidateExecution": {
      "anchor": "READY_DOCTOR_PASS_AND_IN_PROGRESS_COMMIT",
      "anchorCommit": "5e9389fbd5bc5d192daaabcabb2e75d9563c2f17",
      "startedAt": "2026-08-15T20:27:14+08:00",
      "endedAt": "2026-08-15T20:41:31+08:00",
      "elapsedSeconds": 857,
      "outcome": "PASS",
      "targetWallMinutes": 60,
      "hardFuseWallMinutes": 90,
      "candidateDeadlineMinutes": 45,
      "closureOnlyOverrunSeconds": 0,
      "readyDoctorPassAt": "2026-08-15T20:26:25+08:00",
      "inProgressCommit": "5e9389fbd5bc5d192daaabcabb2e75d9563c2f17"
    }
  },
  "reviewers": [],
  "checks": [
    {
      "command": "PATH=/Users/hxf/.zcode/venvs/vc-harness/bin:$PATH python scripts/harness/precheck.py --task TASK-0212",
      "status": "PASS",
      "exitCode": 0,
      "artifactHash": null,
      "reason": "Official candidate precheck PASS (8 commands). Inner doctor --task TASK-0212 PASS 1021864 checks / 158.7s / exit 0 on 5e9389f.",
      "environment": "macOS; scratch task-0212-precheck.log",
      "verifiedCommit": "5e9389fbd5bc5d192daaabcabb2e75d9563c2f17",
      "candidateCommit": "5e9389fbd5bc5d192daaabcabb2e75d9563c2f17",
      "candidateTree": "5ef29cc94c422c2d364258c6a6b79d268b4d6d4c"
    },
    {
      "command": "pnpm --dir frontend exec vitest run src/pages/memory/memory.spec.ts src/components/RelationshipSelector.spec.ts",
      "status": "PASS",
      "exitCode": 0,
      "artifactHash": null,
      "reason": "29/29 tests PASS on candidate 5e9389f (memory 18 + selector 11): memory hides create controls, selector default still shows create, create-free empty copy, existing pick/prefill/nav tests still pass.",
      "environment": "macOS; vitest 3.2.6; scratch task-0212-required-commands.log",
      "verifiedCommit": "5e9389fbd5bc5d192daaabcabb2e75d9563c2f17",
      "candidateCommit": "5e9389fbd5bc5d192daaabcabb2e75d9563c2f17",
      "candidateTree": "5ef29cc94c422c2d364258c6a6b79d268b4d6d4c"
    },
    {
      "command": "git diff --check",
      "status": "PASS",
      "exitCode": 0,
      "artifactHash": null,
      "reason": "git diff --check exit 0 on candidate 5e9389f.",
      "environment": "macOS",
      "verifiedCommit": "5e9389fbd5bc5d192daaabcabb2e75d9563c2f17"
    },
    {
      "command": "PATH=/Users/hxf/.zcode/venvs/vc-harness/bin:$PATH python scripts/harness/doctor.py --task TASK-0212 --pre-closure",
      "status": "PASS",
      "exitCode": 0,
      "artifactHash": null,
      "reason": "Official staged-terminal pre-closure PASS 1279072 checks / 614.6s / exit 0.",
      "environment": "macOS; scratch task-0212-preclosure-1.log",
      "verifiedCommit": "5e9389fbd5bc5d192daaabcabb2e75d9563c2f17",
      "candidateCommit": "5e9389fbd5bc5d192daaabcabb2e75d9563c2f17",
      "candidateTree": "5ef29cc94c422c2d364258c6a6b79d268b4d6d4c"
    }
  ]
}
