{
  "taskId": "TASK-0199",
  "baseCommit": "e20a966943bb0fcb40770ab0fe5493e330a2fa0c",
  "headCommit": "19c4a82f2fbcda8689aba109de2b2fcc9d5f75c3",
  "contextFingerprint": "e9829688676e83c6a2625857b438f0ae824659bc7827488836acda3ca0e27599",
  "deliveryTiming": {
    "overallElapsed": {
      "anchor": "DRAFT_COMMIT",
      "anchorCommit": "ff1ece7754e357fbbf991b7543e3722db076110f",
      "startedAt": "2026-08-15T12:26:47+08:00",
      "endedAt": "2026-08-15T12:33:35+08:00",
      "elapsedSeconds": 408,
      "reanchored": false
    },
    "intakeActivation": {
      "anchor": "DRAFT_COMMIT",
      "anchorCommit": "ff1ece7754e357fbbf991b7543e3722db076110f",
      "startedAt": "2026-08-15T12:26:47+08:00",
      "endedAt": "2026-08-15T12:30:19+08:00",
      "elapsedSeconds": 212,
      "outcome": "PASS",
      "targetWallMinutes": 60,
      "hardFuseWallMinutes": 90,
      "closureOnlyOverrunSeconds": 0,
      "readyDoctorPassAt": "2026-08-15T12:30:19+08:00",
      "inProgressCommit": "19c4a82f2fbcda8689aba109de2b2fcc9d5f75c3"
    },
    "candidateExecution": {
      "anchor": "READY_DOCTOR_PASS_AND_IN_PROGRESS_COMMIT",
      "anchorCommit": "19c4a82f2fbcda8689aba109de2b2fcc9d5f75c3",
      "startedAt": "2026-08-15T12:31:29+08:00",
      "endedAt": "2026-08-15T12:33:35+08:00",
      "elapsedSeconds": 126,
      "outcome": "PASS",
      "targetWallMinutes": 60,
      "hardFuseWallMinutes": 90,
      "candidateDeadlineMinutes": 45,
      "closureOnlyOverrunSeconds": 0,
      "readyDoctorPassAt": "2026-08-15T12:30:19+08:00",
      "inProgressCommit": "19c4a82f2fbcda8689aba109de2b2fcc9d5f75c3"
    }
  },
  "reviewers": [],
  "checks": [
    {
      "command": "PATH=/Users/hxf/.zcode/venvs/vc-harness/bin:$PATH python scripts/harness/precheck.py --task TASK-0199",
      "status": "PASS",
      "exitCode": 0,
      "artifactHash": null,
      "reason": "Official candidate precheck PASS (8 commands). Inner doctor --task TASK-0199 PASS 933220 checks / 101.5s / exit 0 on 19c4a82.",
      "environment": "macOS; scratch task-0199-precheck.log",
      "verifiedCommit": "19c4a82f2fbcda8689aba109de2b2fcc9d5f75c3",
      "candidateCommit": "19c4a82f2fbcda8689aba109de2b2fcc9d5f75c3",
      "candidateTree": "48f1023e0e82cba5845bbc43a100aa39058d5174"
    },
    {
      "command": "pnpm --dir frontend exec vitest run src/pages/chat/chat.spec.ts",
      "status": "PASS",
      "exitCode": 0,
      "artifactHash": null,
      "reason": "8/8 tests PASS including empty-history visible and hidden-after-messages cases.",
      "environment": "macOS; vitest 3.2.6; scratch task-0199-required-commands.log",
      "verifiedCommit": "19c4a82f2fbcda8689aba109de2b2fcc9d5f75c3",
      "candidateCommit": "19c4a82f2fbcda8689aba109de2b2fcc9d5f75c3",
      "candidateTree": "48f1023e0e82cba5845bbc43a100aa39058d5174"
    },
    {
      "command": "git diff --check",
      "status": "PASS",
      "exitCode": 0,
      "artifactHash": null,
      "reason": "git diff --check exit 0 on candidate 19c4a82.",
      "environment": "macOS",
      "verifiedCommit": "19c4a82f2fbcda8689aba109de2b2fcc9d5f75c3"
    },
    {
      "command": "PATH=/Users/hxf/.zcode/venvs/vc-harness/bin:$PATH python scripts/harness/doctor.py --task TASK-0199 --pre-closure",
      "status": "PASS",
      "exitCode": 0,
      "artifactHash": null,
      "reason": "Official staged-terminal pre-closure PASS 1159368 checks / 514.3s / exit 0.",
      "environment": "macOS; scratch task-0199-preclosure-1.log",
      "verifiedCommit": "19c4a82f2fbcda8689aba109de2b2fcc9d5f75c3",
      "candidateCommit": "19c4a82f2fbcda8689aba109de2b2fcc9d5f75c3",
      "candidateTree": "48f1023e0e82cba5845bbc43a100aa39058d5174"
    }
  ]
}
