{
  "taskId": "TASK-0222",
  "baseCommit": "98796c05ab2dee73eadb1e42a6f59df019274755",
  "headCommit": "56f08b721deccc6a773e311a065f113ee6eb53f6",
  "contextFingerprint": "dd36d27592347835a697c215c1c5706ba79d0e283b05672de98276afb797ad69",
  "deliveryTiming": {
    "overallElapsed": {
      "anchor": "DRAFT_COMMIT",
      "anchorCommit": "41077d7acbafec3e024706473c5da1492567c63a",
      "startedAt": "2026-08-15T22:35:58+08:00",
      "endedAt": "2026-08-15T22:36:40+08:00",
      "elapsedSeconds": 42,
      "reanchored": false
    },
    "intakeActivation": {
      "anchor": "DRAFT_COMMIT",
      "anchorCommit": "41077d7acbafec3e024706473c5da1492567c63a",
      "startedAt": "2026-08-15T22:35:58+08:00",
      "endedAt": "2026-08-15T22:36:00+08:00",
      "elapsedSeconds": 2,
      "outcome": "UNKNOWN",
      "targetWallMinutes": 60,
      "hardFuseWallMinutes": 90,
      "closureOnlyOverrunSeconds": 0,
      "inProgressCommit": "56f08b721deccc6a773e311a065f113ee6eb53f6"
    },
    "candidateExecution": {
      "anchor": "READY_DOCTOR_PASS_AND_IN_PROGRESS_COMMIT",
      "anchorCommit": "56f08b721deccc6a773e311a065f113ee6eb53f6",
      "startedAt": "2026-08-15T22:36:25+08:00",
      "endedAt": "2026-08-15T22:36:40+08:00",
      "elapsedSeconds": 15,
      "outcome": "PASS",
      "targetWallMinutes": 60,
      "hardFuseWallMinutes": 90,
      "candidateDeadlineMinutes": 45,
      "closureOnlyOverrunSeconds": 0,
      "readyDoctorPassAt": "2026-08-15T22:36:00+08:00",
      "inProgressCommit": "56f08b721deccc6a773e311a065f113ee6eb53f6"
    }
  },
  "reviewers": [],
  "checks": [
    {
      "command": "pnpm --dir frontend exec vitest run src/pages/index/index.spec.ts",
      "status": "PASS",
      "exitCode": 0,
      "artifactHash": null,
      "reason": "6/6 tests PASS on candidate 56f08b7: chatHref carries current relationship after load, bare path when none, no activate/create, existing memory-carry tests still pass.",
      "environment": "macOS; vitest 3.2.6",
      "verifiedCommit": "56f08b721deccc6a773e311a065f113ee6eb53f6",
      "candidateCommit": "56f08b721deccc6a773e311a065f113ee6eb53f6",
      "candidateTree": "b41830e4b397d5c34b51dfe6af51ceb3ad273d95"
    },
    {
      "command": "git diff --check",
      "status": "PASS",
      "exitCode": 0,
      "artifactHash": null,
      "reason": "git diff --check exit 0 on candidate 56f08b7.",
      "environment": "macOS",
      "verifiedCommit": "56f08b721deccc6a773e311a065f113ee6eb53f6"
    },
    {
      "command": "PATH=/Users/hxf/.zcode/venvs/vc-harness/bin:$PATH python scripts/harness/doctor.py --task TASK-0222",
      "status": "NOT_RUN",
      "exitCode": null,
      "artifactHash": null,
      "reason": "Owner 本轮 Goal 明确不跑长 Doctor。Honest NOT_RUN, never PASS.",
      "environment": "macOS; skipped"
    },
    {
      "command": "PATH=/Users/hxf/.zcode/venvs/vc-harness/bin:$PATH python scripts/harness/precheck.py --task TASK-0222",
      "status": "NOT_RUN",
      "exitCode": null,
      "artifactHash": null,
      "reason": "Owner 本轮 Goal 明确不跑长 precheck。Honest NOT_RUN, never PASS.",
      "environment": "macOS; skipped"
    },
    {
      "command": "PATH=/Users/hxf/.zcode/venvs/vc-harness/bin:$PATH python scripts/harness/doctor.py --task TASK-0222 --pre-closure",
      "status": "NOT_RUN",
      "exitCode": null,
      "artifactHash": null,
      "reason": "Owner 本轮 Goal 明确不跑长 pre-closure。Honest NOT_RUN, never PASS.",
      "environment": "macOS; skipped"
    }
  ]
}
