{
  "taskId": "TASK-0215",
  "baseCommit": "e69c00b4a12d6291dadf5e890aa2738d8e2c8229",
  "headCommit": "3c4d0352cd591b09f0bdebf7566da65bc3a46fde",
  "contextFingerprint": "594f71b77c85449cd2eef3f45fddd7376cc150149f5ac22e8c2c8842a196d49d",
  "deliveryTiming": {
    "overallElapsed": {
      "anchor": "DRAFT_COMMIT",
      "anchorCommit": "3059cad89b2b7fd25ac6004b9cab50dfebb6606d",
      "startedAt": "2026-08-15T20:58:31+08:00",
      "endedAt": "2026-08-15T21:00:00+08:00",
      "elapsedSeconds": 89,
      "reanchored": false
    },
    "intakeActivation": {
      "anchor": "DRAFT_COMMIT",
      "anchorCommit": "3059cad89b2b7fd25ac6004b9cab50dfebb6606d",
      "startedAt": "2026-08-15T20:58:31+08:00",
      "endedAt": "2026-08-15T20:58:43+08:00",
      "elapsedSeconds": 12,
      "outcome": "UNKNOWN",
      "targetWallMinutes": 60,
      "hardFuseWallMinutes": 90,
      "closureOnlyOverrunSeconds": 0,
      "inProgressCommit": "3c4d0352cd591b09f0bdebf7566da65bc3a46fde"
    },
    "candidateExecution": {
      "anchor": "READY_DOCTOR_PASS_AND_IN_PROGRESS_COMMIT",
      "anchorCommit": "3c4d0352cd591b09f0bdebf7566da65bc3a46fde",
      "startedAt": "2026-08-15T20:59:20+08:00",
      "endedAt": "2026-08-15T21:00:00+08:00",
      "elapsedSeconds": 40,
      "outcome": "PASS",
      "targetWallMinutes": 60,
      "hardFuseWallMinutes": 90,
      "candidateDeadlineMinutes": 45,
      "closureOnlyOverrunSeconds": 0,
      "readyDoctorPassAt": "2026-08-15T20:58:43+08:00",
      "inProgressCommit": "3c4d0352cd591b09f0bdebf7566da65bc3a46fde"
    }
  },
  "reviewers": [],
  "checks": [
    {
      "command": "pnpm --dir frontend exec vitest run src/pages/login/login.spec.ts",
      "status": "PASS",
      "exitCode": 0,
      "artifactHash": null,
      "reason": "7/7 tests PASS on candidate 3c4d035: nav-index visible, click navigates to index without login, existing empty-submit and fail-focus tests still pass.",
      "environment": "macOS; vitest 3.2.6; scratch task-0215-required-commands.log",
      "verifiedCommit": "3c4d0352cd591b09f0bdebf7566da65bc3a46fde",
      "candidateCommit": "3c4d0352cd591b09f0bdebf7566da65bc3a46fde",
      "candidateTree": "54c8770c85c79adcc2300a2b25f04c1192d536a4"
    },
    {
      "command": "git diff --check",
      "status": "PASS",
      "exitCode": 0,
      "artifactHash": null,
      "reason": "git diff --check exit 0 on candidate 3c4d035.",
      "environment": "macOS",
      "verifiedCommit": "3c4d0352cd591b09f0bdebf7566da65bc3a46fde"
    },
    {
      "command": "PATH=/Users/hxf/.zcode/venvs/vc-harness/bin:$PATH python scripts/harness/doctor.py --task TASK-0215",
      "status": "NOT_RUN",
      "exitCode": null,
      "artifactHash": null,
      "reason": "Owner 本轮 Goal 明确不跑长 Doctor。Honest NOT_RUN, never PASS.",
      "environment": "macOS; skipped"
    },
    {
      "command": "PATH=/Users/hxf/.zcode/venvs/vc-harness/bin:$PATH python scripts/harness/precheck.py --task TASK-0215",
      "status": "NOT_RUN",
      "exitCode": null,
      "artifactHash": null,
      "reason": "Owner 本轮 Goal 明确不跑长 precheck。Honest NOT_RUN, never PASS.",
      "environment": "macOS; skipped"
    },
    {
      "command": "PATH=/Users/hxf/.zcode/venvs/vc-harness/bin:$PATH python scripts/harness/doctor.py --task TASK-0215 --pre-closure",
      "status": "NOT_RUN",
      "exitCode": null,
      "artifactHash": null,
      "reason": "Owner 本轮 Goal 明确不跑长 pre-closure。Honest NOT_RUN, never PASS.",
      "environment": "macOS; skipped"
    }
  ]
}
